{
  "apiVersion": "air.dev/check-result/v0.1",
  "kind": "CheckResult",
  "generatedAt": "2026-10-22T11:33:12.177Z",
  "baselineId": "bb314da75345fa0dcd7116e3c49f852b363552b301f0b07e9d7e6c62a0696a5d",
  "candidate": {
    "name": "candidate",
    "targetHash": "665b2ecdd0ef2157bebeda0f24ae2012786e516d13d79b610d22592207a78d58"
  },
  "passed": true,
  "policy": {
    "passed": true,
    "violations": []
  },
  "scenarios": [
    {
      "id": "moves-funds-atomically",
      "passed": true
    },
    {
      "id": "rolls-back-insufficient-funds",
      "passed": true
    },
    {
      "id": "replays-transfer",
      "passed": true
    },
    {
      "id": "rejects-version-conflict",
      "passed": true
    },
    {
      "id": "moves-funds-atomically-holdout",
      "passed": true
    },
    {
      "id": "rolls-back-insufficient-funds-holdout",
      "passed": true
    },
    {
      "id": "replays-transfer-holdout",
      "passed": true
    },
    {
      "id": "rejects-version-conflict-holdout",
      "passed": true
    }
  ],
  "mismatches": []
}
