{
  "apiVersion": "air.dev/check-result/v0.1",
  "kind": "CheckResult",
  "generatedAt": "2026-10-22T08:26:11.832Z",
  "baselineId": "f32541e93bfe55a1b5948c23a6ed24a3cba0726d3285fdef95f2ad9bc7d1436a",
  "candidate": {
    "name": "candidate",
    "targetHash": "665b2ecdd0ef2157bebeda0f24ae2012786e516d13d79b610d22592207a78d58"
  },
  "passed": false,
  "policy": {
    "passed": true,
    "violations": []
  },
  "scenarios": [
    {
      "id": "lists-owned-books",
      "passed": false
    },
    {
      "id": "forbids-foreign-delete",
      "passed": false
    },
    {
      "id": "returns-ordered-page",
      "passed": false
    },
    {
      "id": "allows-owner-delete",
      "passed": true
    }
  ],
  "mismatches": [
    {
      "classification": "missing-observation",
      "scenario": "lists-owned-books",
      "category": "http",
      "selector": "/http/body/limit",
      "expected": {
        "type": "number",
        "bytes": 1,
        "sha256": "d4735e3a265e16eee03f59718b9b5d03019c07d8b6c51f90da3a666eec13ab35"
      },
      "provenance": "baseline:lists-owned-books/http/body/limit",
      "repair": "harness"
    },
    {
      "classification": "missing-observation",
      "scenario": "lists-owned-books",
      "category": "http",
      "selector": "/http/body/offset",
      "expected": {
        "type": "number",
        "bytes": 1,
        "sha256": "5feceb66ffc86f38d952786c6d696c79c2dbc239dd4e91b46729d73a27fb57e9"
      },
      "provenance": "baseline:lists-owned-books/http/body/offset",
      "repair": "harness"
    },
    {
      "classification": "missing-observation",
      "scenario": "forbids-foreign-delete",
      "category": "failures",
      "selector": "/failures/0",
      "expected": {
        "type": "object",
        "bytes": 413,
        "sha256": "d38dec469bfebd143c9de416b38034b3e88a6a245727b105707e85d15b53c9fb"
      },
      "provenance": "baseline:forbids-foreign-delete/failures/0",
      "repair": "harness"
    },
    {
      "classification": "candidate-difference",
      "scenario": "forbids-foreign-delete",
      "category": "http",
      "selector": "/http/body/error",
      "expected": {
        "type": "object",
        "bytes": 155,
        "sha256": "fa2ee70dd2ad0d01c04e19a63b9fb6e5b78ec525777ff049385ddbe8b4df237c"
      },
      "actual": {
        "type": "string",
        "bytes": 11,
        "sha256": "d049d3c38e9b1c0f1b2eb82353d5a9c2b29172b63c4a62aaf2cebdb09eb434c8"
      },
      "provenance": "baseline:forbids-foreign-delete/http/body/error",
      "repair": "candidate-code"
    },
    {
      "classification": "missing-observation",
      "scenario": "returns-ordered-page",
      "category": "http",
      "selector": "/http/body/limit",
      "expected": {
        "type": "number",
        "bytes": 1,
        "sha256": "d4735e3a265e16eee03f59718b9b5d03019c07d8b6c51f90da3a666eec13ab35"
      },
      "provenance": "baseline:returns-ordered-page/http/body/limit",
      "repair": "harness"
    },
    {
      "classification": "missing-observation",
      "scenario": "returns-ordered-page",
      "category": "http",
      "selector": "/http/body/offset",
      "expected": {
        "type": "number",
        "bytes": 1,
        "sha256": "6b86b273ff34fce19d6b804eff5a3f5747ada4eaa22f1d49c01e52ddb7875b4b"
      },
      "provenance": "baseline:returns-ordered-page/http/body/offset",
      "repair": "harness"
    }
  ]
}
